{
  "$schema": "http://json-schema.org/draft-07/schema#",
  "type": ["object", "null"],
  "title": "CPU Cooler Schema",
  "description": "Schema for CPU Cooler components",
  "required": ["metadata"],
  "properties": {
    "opendb_id": {
      "type": ["string", "null"],
      "description": "Unique identifier for the document (UUID v4)"
    },
    "weight": {
      "description": "Product weight in grams for one complete, usable unit of this exact variant. Exclude retail packaging, shipping materials, multipack totals, and load capacity. Leave unset when the product is digital, the weight is unknown, or the source does not clearly identify product weight.",
      "type": ["number", "null"],
      "exclusiveMinimum": 0
    },
    "min_fan_rpm": {
      "description": "Min value of the fan's rotational speed in RPM. If constant, fill in min_fan_rpm and ignore max_fan_rpm",
      "type": ["number", "null"]
    },
    "max_fan_rpm": {
      "description": "Max value of the fan's rotational speed in RPM. If constant, fill in min_fan_rpm and ignore max_fan_rpm",
      "type": ["number", "null"]
    },
    "min_noise_level": {
      "description": "The min noise level of the cooler in dB. If constant, fill in min_noise_level and ignore max_noise_level",
      "type": ["number", "null"]
    },
    "max_noise_level": {
      "description": "The max noise level of the cooler in dB. If constant, fill in min_noise_level and ignore max_noise_level",
      "type": ["number", "null"]
    },
    "color": {
      "description": "The color(s) of this product. Each color of the product should be included in the array. Do not use RGB here to describe lighting; use the Lighting field for RGB, ARGB, display, or fixed-color lighting. Includes heatsink or radiator assembly colors",
      "type": ["array", "null"],
      "items": {
        "type": "string",
        "enum": [
          "BLACK",
          "WHITE",
          "RGB",
          "RED",
          "BLUE",
          "GREEN",
          "GREY",
          "YELLOW",
          "ORANGE",
          "PURPLE",
          "PINK",
          "BROWN",
          "GOLD"
        ]
      }
    },
    "lighting": {
      "description": "Lighting capabilities for this product. Use RGB for non-addressable RGB, ARGB for addressable RGB, Multicolor for non-RGB multi-color lighting, Fixed for a single fixed lighting color, None when the product has no lighting, Display for configurable displays, and Fixed Color Display for displays limited to fixed colors such as black and white.",
      "type": ["array", "null"],
      "items": {
        "type": "string",
        "enum": ["RGB", "ARGB", "Multicolor", "Fixed", "None", "Display", "Fixed Color Display"]
      }
    },
    "height": {
      "description": "The height of the CPU cooler in mm",
      "type": ["number", "null"]
    },
    "cpu_sockets": {
      "description": "An array of CPU socket types supported by the cooler (e.g., AM4, AM5, LGA 1700, LGA 1200)",
      "type": ["array", "null"],
      "items": {
        "type": "string",
        "enum": [
          "AM5",
          "AM4",
          "AM3+",
          "AM3",
          "AM2+",
          "AM2",
          "AM1",
          "FM2+",
          "FM2",
          "FM1",
          "sWRX8",
          "sTR5",
          "sTRX4",
          "sTR4",
          "TR4",
          "LGA 1954",
          "LGA 1851",
          "LGA 1700",
          "LGA 1200",
          "LGA 1151",
          "LGA 1151v2",
          "LGA 1150",
          "LGA 1155",
          "LGA 1156",
          "LGA 2066",
          "LGA 2011-3",
          "LGA 2011-3 Narrow",
          "LGA 2011",
          "LGA 1366",
          "LGA 1356",
          "LGA 775",
          "LGA 7529",
          "LGA 4710",
          "LGA 4677",
          "LGA 4189",
          "LGA 3647",
          "LGA 1121",
          "G34",
          "SP6",
          "SP5",
          "SP3",
          "2 x LGA 2011",
          "2 x LGA 2011-3",
          "2 x LGA 2011-3 Narrow",
          "2 x LGA 1366",
          "2 x G34",
          "Integrated Atom",
          "Integrated Xeon D",
          "Integrated Pentium",
          "Integrated AMD",
          "LGA 115"
        ]
      }
    },
    "water_cooled": {
      "description": "Indicates if the cooler is water-cooled",
      "type": ["boolean", "null"]
    },
    "radiator_size": {
      "description": "Radiator size in mm (e.g. 360, 280, 240). Populate this for water-cooled models.",
      "type": ["number", "null"]
    },
    "fanless": {
      "description": "Whether the cooler can operate fanless",
      "type": ["boolean", "null"]
    },
    "fan_size": {
      "description": "Size of the included fan(s) in mm (e.g. 140, 120)",
      "type": ["number", "null"]
    },
    "fan_quantity": {
      "description": "Number of included fans",
      "type": ["number", "null"]
    },
    "general_product_information": {
      "type": ["object", "null"],
      "description": "General product information and retailer SKUs",
      "properties": {
        "amazon_sku": {
          "type": ["string", "null"],
          "description": "Amazon product SKU"
        },
        "newegg_sku": {
          "type": ["string", "null"],
          "description": "Newegg product SKU"
        },
        "bestbuy_sku": {
          "type": ["number", "null"],
          "description": "Best Buy product SKU"
        },
        "walmart_sku": {
          "type": ["number", "null"],
          "description": "Walmart product SKU"
        },
        "adorama_sku": {
          "type": ["string", "null"],
          "description": "Adorama product SKU"
        },
        "ibuypower_sku": {
          "type": ["string", "null"],
          "description": "iBuyPower product SKU"
        },
        "hyte_sku": {
          "type": ["string", "null"],
          "description": "HYTE product SKU"
        },
        "lttstore_sku": {
          "type": ["string", "null"],
          "description": "LTTStore product SKU"
        },
        "manufacturer_url": {
          "type": ["string", "null"],
          "description": "Official manufacturer product URL"
        }
      }
    },
    "metadata": {
      "type": ["object", "null"],
      "properties": {
        "name": {
          "description": "Full product name",
          "type": ["string", "null"]
        },
        "manufacturer": {
          "description": "CPU Cooler manufacturer",
          "type": ["string", "null"]
        },
        "part_numbers": {
          "description": "Array of manufacturer's part numbers/SKUs",
          "type": ["array", "null"],
          "items": {
            "type": "string"
          }
        },
        "series": {
          "description": "Product series name The manufacturer's marketed product line / family for the cooler. Manufacturer and `water_cooled` (Liquid vs Air) are stored separately and form the default grouping; `radiator_size`, `fan_size`, `manufacturer_color`, and fan count are also separate fields and MUST NOT be in the series. Examples: 'NZXT Kraken Plus 360mm Black' → series='Kraken Plus' (liquid). 'Corsair iCUE H150i Elite Capellix XT' → series='iCUE Elite Capellix XT' (the H150i prefix encodes radiator size, which lives in `radiator_size`). 'Noctua NH-D15' → series='NH-D15' (air). The series stays consistent across radiator-size / color SKUs of the same product line.",
          "type": ["string", "null"]
        },
        "variant": {
          "description": "Specific variant in the series Most coolers should have an empty variant. Radiator size lives in `radiator_size`, fan size in `fan_size`, fan count in `fan_quantity`, color (including Noctua's `chromax.black` / `chromax.black.swap`) in `manufacturer_color`. Only fill `variant` when the manufacturer ships a genuinely distinct sub-model under the same series name that is NOT captured by another field (different cold-plate, regional / OEM-only spin, named accessory kit). Examples: 'NZXT Kraken Plus 240mm Black' / 'NZXT Kraken Plus 360mm Black' → variant='' for both (only `radiator_size` differs). 'Noctua NH-D15 chromax.black' → variant='' with manufacturer_color='chromax.black'. 'be quiet! Dark Rock Pro 5' (single SKU per family) → variant=''. The variant must be unique within a (manufacturer, series, water_cooled, manufacturer_color, radiator_size, fan_size) group; if every cooler collapses to the same value, leave it empty.",
          "type": ["string", "null"]
        },
        "releaseYear": {
          "description": "Year of release",
          "type": ["number", "null"]
        },
        "manufacturer_color": {
          "description": "Manufacturer's official color name for this product variant. The manufacturer's marketed colorway / finish name, verbatim. Common values: 'Black', 'White', 'Black / White'. Multi-tone coolers use ' / '. Branded special / collab colorways belong here when the rest of the SKU is identical (e.g., 'Hatsune Miku Edition'). Noctua's signature finishes ('Brown / Beige', 'chromax.black') also go here. Most stock coolers are 'Black'. Do NOT put radiator size, fan size, 'RGB', or family / model words in manufacturer_color — those belong in dedicated fields or the series.",
          "type": ["string", "null"]
        },
        "last_manually_spec_verified_at": {
          "type": ["string", "null"],
          "format": "date-time",
          "description": "ISO 8601 timestamp of when the part specs were last manually verified by a human"
        }
      },
      "required": ["name"]
    },
    "identifiers": {
      "type": "object",
      "properties": {
        "version": {
          "type": "integer",
          "exclusiveMinimum": 0,
          "maximum": 9007199254740991,
          "description": "Monotonically increasing identity snapshot version"
        },
        "identifiers": {
          "type": "array",
          "items": {
            "type": "object",
            "properties": {
              "type": {
                "type": "string",
                "enum": ["upc", "ean", "gtin", "mpn"]
              },
              "value": {
                "type": "string",
                "minLength": 1
              },
              "region": {
                "default": "all",
                "type": "string",
                "minLength": 1
              }
            },
            "required": ["type", "value", "region"],
            "additionalProperties": false
          },
          "description": "Canonical product identifiers"
        },
        "retailer_listings": {
          "type": "array",
          "items": {
            "type": "object",
            "properties": {
              "source": {
                "type": "string",
                "minLength": 1
              },
              "channel": {
                "type": "string",
                "minLength": 1
              },
              "source_product_id": {
                "type": "string",
                "minLength": 1
              },
              "pricing_enabled": {
                "type": "boolean"
              },
              "excluded_source_offer_ids": {
                "type": "array",
                "items": {
                  "type": "string",
                  "minLength": 1,
                  "maxLength": 512
                }
              },
              "verified": {
                "type": "boolean"
              }
            },
            "required": ["source", "channel", "source_product_id", "pricing_enabled", "verified"],
            "additionalProperties": false
          },
          "description": "Canonical retailer product listings used for pricing"
        }
      },
      "required": ["version", "identifiers", "retailer_listings"],
      "additionalProperties": false,
      "description": "Current versioned product identity snapshot used for retailer and pricing matching"
    }
  }
}
