{
  "opendb_id": "011fd943-9d64-4f59-9ea9-cc349a356d9e",
  "min_fan_rpm": 500,
  "max_fan_rpm": 2000,
  "min_noise_level": 14.3,
  "max_noise_level": 34.3,
  "color": ["BLACK"],
  "lighting": [],
  "height": null,
  "cpu_sockets": [
    "AM2",
    "AM3",
    "AM4",
    "AM5",
    "FM1",
    "FM2",
    "LGA 1150",
    "LGA 1151",
    "LGA 1155",
    "LGA 1156",
    "LGA 1200",
    "LGA 1366",
    "LGA 1700",
    "LGA 1851",
    "LGA 2011",
    "LGA 2066"
  ],
  "water_cooled": true,
  "radiator_size": 240,
  "fanless": false,
  "fan_size": null,
  "fan_quantity": null,
  "metadata": {
    "name": "MSI MAG CORELIQUID C240 Water 240mm EVA e-PROJECT Black",
    "manufacturer": "MSI",
    "part_numbers": ["MAG CORELIQUID C240 EVA e-PROJECT", "9B35-846-043"],
    "series": "MAG",
    "variant": "Black",
    "releaseYear": null
  },
  "general_product_information": {},
  "identifiers": {
    "version": 1,
    "identifiers": [
      {
        "type": "ean",
        "value": "0824142281352",
        "region": "all"
      },
      {
        "type": "mpn",
        "value": "9B35-846-043",
        "region": "all"
      },
      {
        "type": "mpn",
        "value": "MAG CORELIQUID C240 EVA e-PROJECT",
        "region": "all"
      },
      {
        "type": "upc",
        "value": "824142281352",
        "region": "all"
      }
    ],
    "retailer_listings": [
      {
        "source": "amazon",
        "channel": "au",
        "source_product_id": "B09Y7B8DQS",
        "pricing_enabled": true,
        "verified": true
      },
      {
        "source": "amazon",
        "channel": "be",
        "source_product_id": "B09Y7B8DQS",
        "pricing_enabled": true,
        "verified": true
      },
      {
        "source": "amazon",
        "channel": "ca",
        "source_product_id": "B09Y7B8DQS",
        "pricing_enabled": true,
        "verified": true
      },
      {
        "source": "amazon",
        "channel": "de",
        "source_product_id": "B09Y7B8DQS",
        "pricing_enabled": true,
        "verified": true
      },
      {
        "source": "amazon",
        "channel": "es",
        "source_product_id": "B09Y7B8DQS",
        "pricing_enabled": true,
        "verified": true
      },
      {
        "source": "amazon",
        "channel": "fr",
        "source_product_id": "B09Y7B8DQS",
        "pricing_enabled": true,
        "verified": true
      },
      {
        "source": "amazon",
        "channel": "ie",
        "source_product_id": "B09Y7B8DQS",
        "pricing_enabled": true,
        "verified": true
      },
      {
        "source": "amazon",
        "channel": "it",
        "source_product_id": "B09Y7B8DQS",
        "pricing_enabled": true,
        "verified": true
      },
      {
        "source": "amazon",
        "channel": "jp",
        "source_product_id": "B09Y7B8DQS",
        "pricing_enabled": true,
        "verified": true
      },
      {
        "source": "amazon",
        "channel": "nl",
        "source_product_id": "B09Y7B8DQS",
        "pricing_enabled": true,
        "verified": true
      },
      {
        "source": "amazon",
        "channel": "pl",
        "source_product_id": "B09Y7B8DQS",
        "pricing_enabled": true,
        "verified": true
      },
      {
        "source": "amazon",
        "channel": "se",
        "source_product_id": "B09Y7B8DQS",
        "pricing_enabled": true,
        "verified": true
      },
      {
        "source": "amazon",
        "channel": "sg",
        "source_product_id": "B09Y7B8DQS",
        "pricing_enabled": true,
        "verified": true
      },
      {
        "source": "amazon",
        "channel": "uk",
        "source_product_id": "B09Y7B8DQS",
        "pricing_enabled": true,
        "verified": true
      },
      {
        "source": "amazon",
        "channel": "us",
        "source_product_id": "B09Y7B8DQS",
        "pricing_enabled": true,
        "verified": true
      }
    ]
  }
}
