{
  "opendb_id": "f8732837-8340-4f37-9568-16bcf55ed871",
  "min_fan_rpm": 2100,
  "min_noise_level": 36.8,
  "color": ["BLACK", "RGB"],
  "lighting": [],
  "height": 82,
  "cpu_sockets": [
    "AM4",
    "AM5",
    "LGA 1150",
    "LGA 1151",
    "LGA 1155",
    "LGA 1156",
    "LGA 1200",
    "LGA 1700",
    "LGA 1851"
  ],
  "water_cooled": true,
  "radiator_size": 360,
  "fanless": false,
  "fan_size": null,
  "fan_quantity": 3,
  "metadata": {
    "name": "be quiet! Light Loop Liquid Water 360mm Black",
    "manufacturer": "be quiet!",
    "part_numbers": ["BW022"],
    "series": "Light Loop",
    "variant": "360mm Black",
    "releaseYear": 2024,
    "manufacturer_color": "Black",
    "last_manually_spec_verified_at": "2026-03-22T17:41:30.782Z"
  },
  "general_product_information": {
    "manufacturer_url": "https://www.bequiet.com/en/watercooler/5184"
  },
  "identifiers": {
    "version": 1,
    "identifiers": [
      {
        "type": "ean",
        "value": "4260052191132",
        "region": "all"
      },
      {
        "type": "mpn",
        "value": "BW022",
        "region": "all"
      },
      {
        "type": "upc",
        "value": "4260052191132",
        "region": "all"
      }
    ],
    "retailer_listings": [
      {
        "source": "alternate",
        "channel": "de",
        "source_product_id": "100077252",
        "pricing_enabled": true,
        "verified": false
      },
      {
        "source": "alternate",
        "channel": "es",
        "source_product_id": "100077252",
        "pricing_enabled": true,
        "verified": false
      },
      {
        "source": "alternate",
        "channel": "fr",
        "source_product_id": "100077252",
        "pricing_enabled": true,
        "verified": false
      },
      {
        "source": "alternate",
        "channel": "it",
        "source_product_id": "100077252",
        "pricing_enabled": true,
        "verified": false
      },
      {
        "source": "amazon",
        "channel": "au",
        "source_product_id": "B0DDR3VT16",
        "pricing_enabled": true,
        "verified": true
      },
      {
        "source": "amazon",
        "channel": "be",
        "source_product_id": "B0DDR3VT16",
        "pricing_enabled": true,
        "verified": true
      },
      {
        "source": "amazon",
        "channel": "ca",
        "source_product_id": "B0DDR3VT16",
        "pricing_enabled": true,
        "verified": true
      },
      {
        "source": "amazon",
        "channel": "de",
        "source_product_id": "B0DDR3VT16",
        "pricing_enabled": true,
        "verified": true
      },
      {
        "source": "amazon",
        "channel": "es",
        "source_product_id": "B0DDR3VT16",
        "pricing_enabled": true,
        "verified": true
      },
      {
        "source": "amazon",
        "channel": "fr",
        "source_product_id": "B0DDR3VT16",
        "pricing_enabled": true,
        "verified": true
      },
      {
        "source": "amazon",
        "channel": "ie",
        "source_product_id": "B0DDR3VT16",
        "pricing_enabled": true,
        "verified": true
      },
      {
        "source": "amazon",
        "channel": "it",
        "source_product_id": "B0DDR3VT16",
        "pricing_enabled": true,
        "verified": true
      },
      {
        "source": "amazon",
        "channel": "jp",
        "source_product_id": "B0DDR3VT16",
        "pricing_enabled": true,
        "verified": true
      },
      {
        "source": "amazon",
        "channel": "nl",
        "source_product_id": "B0DDR3VT16",
        "pricing_enabled": true,
        "verified": true
      },
      {
        "source": "amazon",
        "channel": "pl",
        "source_product_id": "B0DDR3VT16",
        "pricing_enabled": true,
        "verified": true
      },
      {
        "source": "amazon",
        "channel": "se",
        "source_product_id": "B0DDR3VT16",
        "pricing_enabled": true,
        "verified": true
      },
      {
        "source": "amazon",
        "channel": "sg",
        "source_product_id": "B0DDR3VT16",
        "pricing_enabled": true,
        "verified": true
      },
      {
        "source": "amazon",
        "channel": "uk",
        "source_product_id": "B0DDR3VT16",
        "pricing_enabled": true,
        "verified": true
      },
      {
        "source": "amazon",
        "channel": "us",
        "source_product_id": "B0DDR3VT16",
        "pricing_enabled": true,
        "verified": true
      },
      {
        "source": "back-to-the-office",
        "channel": "uk",
        "source_product_id": "55306347774334",
        "pricing_enabled": true,
        "verified": false
      },
      {
        "source": "bhphoto",
        "channel": "us",
        "source_product_id": "BEBW022",
        "pricing_enabled": true,
        "verified": false
      },
      {
        "source": "box",
        "channel": "uk",
        "source_product_id": "BW022",
        "pricing_enabled": true,
        "verified": false
      },
      {
        "source": "caseking",
        "channel": "de",
        "source_product_id": "WASE-894",
        "pricing_enabled": true,
        "verified": false
      },
      {
        "source": "ccl",
        "channel": "uk",
        "source_product_id": "CLR3111",
        "pricing_enabled": true,
        "verified": false
      },
      {
        "source": "cenowarka",
        "channel": "pl",
        "source_product_id": "3289702",
        "pricing_enabled": true,
        "verified": false
      },
      {
        "source": "cyberport",
        "channel": "de",
        "source_product_id": "2222-01K",
        "pricing_enabled": true,
        "verified": false
      },
      {
        "source": "geizhals",
        "channel": "de",
        "source_product_id": "3289702",
        "pricing_enabled": true,
        "verified": false
      },
      {
        "source": "ibuypower",
        "channel": "us",
        "source_product_id": "29337",
        "pricing_enabled": true,
        "verified": true
      },
      {
        "source": "jimms-pc",
        "channel": "fi",
        "source_product_id": "206479",
        "pricing_enabled": true,
        "verified": false
      },
      {
        "source": "laptop-outlet",
        "channel": "uk",
        "source_product_id": "BW022",
        "pricing_enabled": true,
        "verified": false
      },
      {
        "source": "newegg",
        "channel": "ca",
        "source_product_id": "N82E16835269020",
        "pricing_enabled": true,
        "verified": true
      },
      {
        "source": "newegg",
        "channel": "us",
        "source_product_id": "N82E16835269020",
        "pricing_enabled": true,
        "verified": true
      },
      {
        "source": "overclockers",
        "channel": "uk",
        "source_product_id": "COO-BEQ-03151",
        "pricing_enabled": true,
        "verified": false
      },
      {
        "source": "paradigit",
        "channel": "ie",
        "source_product_id": "21647267",
        "pricing_enabled": true,
        "verified": false
      },
      {
        "source": "paradigit",
        "channel": "nl",
        "source_product_id": "21647267",
        "pricing_enabled": true,
        "verified": false
      },
      {
        "source": "proshop",
        "channel": "de",
        "source_product_id": "3298791",
        "pricing_enabled": true,
        "verified": false
      },
      {
        "source": "proshop",
        "channel": "fi",
        "source_product_id": "3298791",
        "pricing_enabled": true,
        "verified": false
      },
      {
        "source": "proshop",
        "channel": "nl",
        "source_product_id": "3298791",
        "pricing_enabled": true,
        "verified": false
      },
      {
        "source": "proshop",
        "channel": "pl",
        "source_product_id": "3298791",
        "pricing_enabled": true,
        "verified": false
      },
      {
        "source": "quzo",
        "channel": "uk",
        "source_product_id": "386561",
        "pricing_enabled": true,
        "verified": false
      },
      {
        "source": "ruedecommerce",
        "channel": "fr",
        "source_product_id": "AR202409040027",
        "pricing_enabled": true,
        "verified": false
      },
      {
        "source": "scan-computer",
        "channel": "uk",
        "source_product_id": "151555",
        "pricing_enabled": true,
        "verified": false
      },
      {
        "source": "skinflint",
        "channel": "uk",
        "source_product_id": "3289702",
        "pricing_enabled": true,
        "verified": false
      },
      {
        "source": "walmart",
        "channel": "us",
        "source_product_id": "11969806866",
        "pricing_enabled": true,
        "verified": false
      }
    ]
  }
}
